{
    "$schema": "http://json-schema.org/schema#",
    "properties": {
        "areas": {
            "items": {
                "properties": {
                    "name": {
                        "type": "string"
                    },
                    "url": {
                        "type": "string"
                    }
                },
                "required": [
                    "name",
                    "url"
                ],
                "type": "object"
            },
            "type": "array"
        },
        "game_indices": {
            "items": {
                "properties": {
                    "game_index": {
                        "type": "integer"
                    },
                    "generation": {
                        "properties": {
                            "name": {
                                "type": "string"
                            },
                            "url": {
                                "type": "string"
                            }
                        },
                        "required": [
                            "name",
                            "url"
                        ],
                        "type": "object"
                    }
                },
                "required": [
                    "game_index",
                    "generation"
                ],
                "type": "object"
            },
            "type": "array"
        },
        "id": {
            "type": "integer"
        },
        "name": {
            "type": "string"
        },
        "names": {
            "items": {
                "properties": {
                    "language": {
                        "properties": {
                            "name": {
                                "type": "string"
                            },
                            "url": {
                                "type": "string"
                            }
                        },
                        "required": [
                            "name",
                            "url"
                        ],
                        "type": "object"
                    },
                    "name": {
                        "type": "string"
                    }
                },
                "required": [
                    "language",
                    "name"
                ],
                "type": "object"
            },
            "type": "array"
        },
        "region": {
            "anyOf": [
                {
                    "type": "null"
                },
                {
                    "properties": {
                        "name": {
                            "type": "string"
                        },
                        "url": {
                            "type": "string"
                        }
                    },
                    "required": [
                        "name",
                        "url"
                    ],
                    "type": "object"
                }
            ]
        }
    },
    "required": [
        "areas",
        "game_indices",
        "id",
        "name",
        "names",
        "region"
    ],
    "type": "object"
}