{"name":"sinnoh-pokemon-league","region":{"url":"http:\/\/127.0.0.1:8000\/api\/v2\/region\/4\/","name":"sinnoh"},"game_indices":[{"generation":{"url":"http:\/\/127.0.0.1:8000\/api\/v2\/generation\/4\/","name":"generation-iv"},"game_index":15}],"names":[{"name":"Pok\u00e9mon League","language":{"url":"http:\/\/127.0.0.1:8000\/api\/v2\/language\/9\/","name":"en"}},{"name":"Ligue Pok\u00e9mon","language":{"url":"http:\/\/127.0.0.1:8000\/api\/v2\/language\/5\/","name":"fr"}}],"id":5,"areas":[{"url":"http:\/\/127.0.0.1:8000\/api\/v2\/location-area\/5\/","name":"sinnoh-pokemon-league-area"}]}
