{
    "areas": [],
    "game_indices": [],
    "id": 579,
    "name": "sealed-chamber",
    "names": [
        {
            "language": {
                "name": "en",
                "url": "http://localhost/api/v2/language/9/"
            },
            "name": "Sealed Chamber"
        },
        {
            "language": {
                "name": "fr",
                "url": "http://localhost/api/v2/language/5/"
            },
            "name": "Sanctuaire"
        }
    ],
    "region": {
        "name": "hoenn",
        "url": "http://localhost/api/v2/region/3/"
    }
}
