{"name":"bell-tower","region":{"url":"http:\/\/127.0.0.1:8000\/api\/v2\/region\/2\/","name":"johto"},"game_indices":[{"generation":{"url":"http:\/\/127.0.0.1:8000\/api\/v2\/generation\/4\/","name":"generation-iv"},"game_index":205}],"names":[{"name":"Bell Tower","language":{"url":"http:\/\/127.0.0.1:8000\/api\/v2\/language\/9\/","name":"en"}},{"name":"Tour Carillon","language":{"url":"http:\/\/127.0.0.1:8000\/api\/v2\/language\/5\/","name":"fr"}}],"id":139,"areas":[{"url":"http:\/\/127.0.0.1:8000\/api\/v2\/location-area\/214\/","name":"bell-tower-2f"},{"url":"http:\/\/127.0.0.1:8000\/api\/v2\/location-area\/215\/","name":"bell-tower-3f"},{"url":"http:\/\/127.0.0.1:8000\/api\/v2\/location-area\/216\/","name":"bell-tower-4f"},{"url":"http:\/\/127.0.0.1:8000\/api\/v2\/location-area\/217\/","name":"bell-tower-5f"},{"url":"http:\/\/127.0.0.1:8000\/api\/v2\/location-area\/218\/","name":"bell-tower-6f"},{"url":"http:\/\/127.0.0.1:8000\/api\/v2\/location-area\/219\/","name":"bell-tower-7f"},{"url":"http:\/\/127.0.0.1:8000\/api\/v2\/location-area\/220\/","name":"bell-tower-8f"},{"url":"http:\/\/127.0.0.1:8000\/api\/v2\/location-area\/221\/","name":"bell-tower-9f"},{"url":"http:\/\/127.0.0.1:8000\/api\/v2\/location-area\/268\/","name":"bell-tower-10f"}]}
