{
    "areas": [
        {
            "name": "hoenn-route-118-area",
            "url": "http://localhost/api/v2/location-area/410/"
        }
    ],
    "game_indices": [],
    "id": 466,
    "name": "hoenn-route-118",
    "names": [
        {
            "language": {
                "name": "en",
                "url": "http://localhost/api/v2/language/9/"
            },
            "name": "Route 118"
        },
        {
            "language": {
                "name": "fr",
                "url": "http://localhost/api/v2/language/5/"
            },
            "name": "Route 118"
        }
    ],
    "region": {
        "name": "hoenn",
        "url": "http://localhost/api/v2/region/3/"
    }
}
