{"name":"jagged-pass","region":{"url":"http:\/\/127.0.0.1:8000\/api\/v2\/region\/3\/","name":"hoenn"},"game_indices":[],"names":[{"name":"Jagged Pass","language":{"url":"http:\/\/127.0.0.1:8000\/api\/v2\/language\/9\/","name":"en"}},{"name":"Sentier Sinuroc","language":{"url":"http:\/\/127.0.0.1:8000\/api\/v2\/language\/5\/","name":"fr"}}],"id":439,"areas":[{"url":"http:\/\/127.0.0.1:8000\/api\/v2\/location-area\/366\/","name":"jagged-pass-area"}]}
