{
    "areas": [
        {
            "name": "johto-route-32-area",
            "url": "http://localhost/api/v2/location-area/192/"
        }
    ],
    "game_indices": [
        {
            "game_index": 180,
            "generation": {
                "name": "generation-iv",
                "url": "http://localhost/api/v2/generation/4/"
            }
        }
    ],
    "id": 112,
    "name": "johto-route-32",
    "names": [
        {
            "language": {
                "name": "en",
                "url": "http://localhost/api/v2/language/9/"
            },
            "name": "Route 32"
        },
        {
            "language": {
                "name": "fr",
                "url": "http://localhost/api/v2/language/5/"
            },
            "name": "Route 32"
        }
    ],
    "region": {
        "name": "johto",
        "url": "http://localhost/api/v2/region/2/"
    }
}
