{
    "areas": [
        {
            "name": "hoenn-route-110-area",
            "url": "http://127.0.0.1:8000/api/v2/location-area/402/"
        }
    ],
    "game_indices": [],
    "id": 458,
    "name": "hoenn-route-110",
    "names": [
        {
            "language": {
                "name": "en",
                "url": "http://127.0.0.1:8000/api/v2/language/9/"
            },
            "name": "Route 110"
        },
        {
            "language": {
                "name": "fr",
                "url": "http://127.0.0.1:8000/api/v2/language/5/"
            },
            "name": "Route 110"
        }
    ],
    "region": {
        "name": "hoenn",
        "url": "http://127.0.0.1:8000/api/v2/region/3/"
    }
}
