{
    "areas": [
        {
            "name": "canalave-city-area",
            "url": "http://127.0.0.1:8000/api/v2/location-area/1/"
        }
    ],
    "game_indices": [
        {
            "game_index": 7,
            "generation": {
                "name": "generation-iv",
                "url": "http://127.0.0.1:8000/api/v2/generation/4/"
            }
        }
    ],
    "id": 1,
    "name": "canalave-city",
    "names": [
        {
            "language": {
                "name": "en",
                "url": "http://127.0.0.1:8000/api/v2/language/9/"
            },
            "name": "Canalave City"
        },
        {
            "language": {
                "name": "fr",
                "url": "http://127.0.0.1:8000/api/v2/language/5/"
            },
            "name": "Joliberges"
        }
    ],
    "region": {
        "name": "sinnoh",
        "url": "http://127.0.0.1:8000/api/v2/region/4/"
    }
}
