{
    "areas": [],
    "game_indices": [],
    "id": 581,
    "name": "island-cave",
    "names": [
        {
            "language": {
                "name": "en",
                "url": "http://localhost/api/v2/language/9/"
            },
            "name": "Island Cave"
        },
        {
            "language": {
                "name": "fr",
                "url": "http://localhost/api/v2/language/5/"
            },
            "name": "Grotte Island"
        }
    ],
    "region": {
        "name": "hoenn",
        "url": "http://localhost/api/v2/region/3/"
    }
}
