{
    "areas": [
        {
            "name": "monean-chamber-area",
            "url": "http://localhost/api/v2/location-area/450/"
        }
    ],
    "game_indices": [],
    "id": 491,
    "name": "monean-chamber",
    "names": [
        {
            "language": {
                "name": "en",
                "url": "http://localhost/api/v2/language/9/"
            },
            "name": "Monean Chamber"
        },
        {
            "language": {
                "name": "fr",
                "url": "http://localhost/api/v2/language/5/"
            },
            "name": "Chambre Anemune"
        }
    ],
    "region": {
        "name": "kanto",
        "url": "http://localhost/api/v2/region/1/"
    }
}
