{"name":"pokeathlon-dome","region":{"url":"http:\/\/127.0.0.1:8000\/api\/v2\/region\/2\/","name":"johto"},"game_indices":[{"generation":{"url":"http:\/\/127.0.0.1:8000\/api\/v2\/generation\/4\/","name":"generation-iv"},"game_index":225}],"names":[{"name":"Pok\u00e9athlon Dome","language":{"url":"http:\/\/127.0.0.1:8000\/api\/v2\/language\/9\/","name":"en"}},{"name":"D\u00f4me Pok\u00e9athlon","language":{"url":"http:\/\/127.0.0.1:8000\/api\/v2\/language\/5\/","name":"fr"}}],"id":241,"areas":[]}
