{"name":"musical-theater","region":{"url":"http:\/\/127.0.0.1:8000\/api\/v2\/region\/5\/","name":"unova"},"game_indices":[{"generation":{"url":"http:\/\/127.0.0.1:8000\/api\/v2\/generation\/5\/","name":"generation-v"},"game_index":49}],"names":[{"name":"Musical Theater","language":{"url":"http:\/\/127.0.0.1:8000\/api\/v2\/language\/9\/","name":"en"}},{"name":"Music-Hall","language":{"url":"http:\/\/127.0.0.1:8000\/api\/v2\/language\/5\/","name":"fr"}},{"name":"\u30df\u30e5\u30fc\u30b8\u30ab\u30eb\u30db\u30fc\u30eb","language":{"url":"http:\/\/127.0.0.1:8000\/api\/v2\/language\/1\/","name":"ja"}}],"id":391,"areas":[]}
