{
    "areas": [
        {
            "name": "hoenn-safari-zone-nwmach-bike-area",
            "url": "http://127.0.0.1:8000/api/v2/location-area/429/"
        },
        {
            "name": "hoenn-safari-zone-neacro-bike-area",
            "url": "http://127.0.0.1:8000/api/v2/location-area/430/"
        },
        {
            "name": "hoenn-safari-zone-sw",
            "url": "http://127.0.0.1:8000/api/v2/location-area/431/"
        },
        {
            "name": "hoenn-safari-zone-se",
            "url": "http://127.0.0.1:8000/api/v2/location-area/432/"
        },
        {
            "name": "hoenn-safari-zone-expansion-south",
            "url": "http://127.0.0.1:8000/api/v2/location-area/435/"
        },
        {
            "name": "hoenn-safari-zone-expansion-north",
            "url": "http://127.0.0.1:8000/api/v2/location-area/436/"
        }
    ],
    "game_indices": [],
    "id": 483,
    "name": "hoenn-safari-zone",
    "names": [
        {
            "language": {
                "name": "en",
                "url": "http://127.0.0.1:8000/api/v2/language/9/"
            },
            "name": "Safari Zone"
        },
        {
            "language": {
                "name": "fr",
                "url": "http://127.0.0.1:8000/api/v2/language/5/"
            },
            "name": "Parc Safari"
        }
    ],
    "region": {
        "name": "hoenn",
        "url": "http://127.0.0.1:8000/api/v2/region/3/"
    }
}
