{"name":"sunyshore-market","region":{"url":"http:\/\/127.0.0.1:8000\/api\/v2\/region\/4\/","name":"sinnoh"},"game_indices":[{"generation":{"url":"http:\/\/127.0.0.1:8000\/api\/v2\/generation\/4\/","name":"generation-iv"},"game_index":105}],"names":[{"name":"Sunyshore Market","language":{"url":"http:\/\/127.0.0.1:8000\/api\/v2\/language\/9\/","name":"en"}},{"name":"March\u00e9 Rivamar","language":{"url":"http:\/\/127.0.0.1:8000\/api\/v2\/language\/5\/","name":"fr"}}],"id":208,"areas":[]}
