{
    "areas": [
        {
            "name": "unova-route-15-area",
            "url": "http://127.0.0.1:8000/api/v2/location-area/650/"
        }
    ],
    "game_indices": [
        {
            "game_index": 28,
            "generation": {
                "name": "generation-v",
                "url": "http://127.0.0.1:8000/api/v2/generation/5/"
            }
        },
        {
            "game_index": 102,
            "generation": {
                "name": "generation-v",
                "url": "http://127.0.0.1:8000/api/v2/generation/5/"
            }
        }
    ],
    "id": 370,
    "name": "unova-route-15",
    "names": [
        {
            "language": {
                "name": "en",
                "url": "http://127.0.0.1:8000/api/v2/language/9/"
            },
            "name": "Route 15"
        },
        {
            "language": {
                "name": "fr",
                "url": "http://127.0.0.1:8000/api/v2/language/5/"
            },
            "name": "Route 15"
        },
        {
            "language": {
                "name": "ja",
                "url": "http://127.0.0.1:8000/api/v2/language/1/"
            },
            "name": "\uff11\uff15\u756a\u9053\u8def"
        }
    ],
    "region": {
        "name": "unova",
        "url": "http://127.0.0.1:8000/api/v2/region/5/"
    }
}
