{"name":"kanto-route-4","region":{"url":"http:\/\/127.0.0.1:8000\/api\/v2\/region\/1\/","name":"kanto"},"game_indices":[{"generation":{"url":"http:\/\/127.0.0.1:8000\/api\/v2\/generation\/4\/","name":"generation-iv"},"game_index":152}],"names":[{"name":"Route 4","language":{"url":"http:\/\/127.0.0.1:8000\/api\/v2\/language\/9\/","name":"en"}},{"name":"Route 4","language":{"url":"http:\/\/127.0.0.1:8000\/api\/v2\/language\/5\/","name":"fr"}}],"id":120,"areas":[{"url":"http:\/\/127.0.0.1:8000\/api\/v2\/location-area\/532\/","name":"kanto-route-4-area"},{"url":"http:\/\/127.0.0.1:8000\/api\/v2\/location-area\/298\/","name":"kanto-route-4-area"}]}
