{
    "areas": [
        {
            "name": "johto-route-46-area",
            "url": "http://127.0.0.1:8000/api/v2/location-area/252/"
        }
    ],
    "game_indices": [
        {
            "game_index": 194,
            "generation": {
                "name": "generation-iv",
                "url": "http://127.0.0.1:8000/api/v2/generation/4/"
            }
        }
    ],
    "id": 127,
    "name": "johto-route-46",
    "names": [
        {
            "language": {
                "name": "en",
                "url": "http://127.0.0.1:8000/api/v2/language/9/"
            },
            "name": "Route 46"
        },
        {
            "language": {
                "name": "fr",
                "url": "http://127.0.0.1:8000/api/v2/language/5/"
            },
            "name": "Route 46"
        }
    ],
    "region": {
        "name": "johto",
        "url": "http://127.0.0.1:8000/api/v2/region/2/"
    }
}
