{"name":"cliff-edge-gate","region":{"url":"http:\/\/127.0.0.1:8000\/api\/v2\/region\/2\/","name":"johto"},"game_indices":[{"generation":{"url":"http:\/\/127.0.0.1:8000\/api\/v2\/generation\/4\/","name":"generation-iv"},"game_index":234}],"names":[{"name":"Cliff Edge Gate","language":{"url":"http:\/\/127.0.0.1:8000\/api\/v2\/language\/9\/","name":"en"}},{"name":"Portail Falaise","language":{"url":"http:\/\/127.0.0.1:8000\/api\/v2\/language\/5\/","name":"fr"}}],"id":250,"areas":[]}
