{
    "areas": [],
    "game_indices": [
        {
            "game_index": 86,
            "generation": {
                "name": "generation-vi",
                "url": "http://127.0.0.1:8000/api/v2/generation/6/"
            }
        }
    ],
    "id": 643,
    "name": "anistar-city",
    "names": [
        {
            "language": {
                "name": "ja-kanji",
                "url": "http://127.0.0.1:8000/api/v2/language/11/"
            },
            "name": "\u30d2\u30e3\u30c3\u30b3\u30af\u30b7\u30c6\u30a3"
        },
        {
            "language": {
                "name": "en",
                "url": "http://127.0.0.1:8000/api/v2/language/9/"
            },
            "name": "Anistar City"
        },
        {
            "language": {
                "name": "it",
                "url": "http://127.0.0.1:8000/api/v2/language/8/"
            },
            "name": "Fluxopoli"
        },
        {
            "language": {
                "name": "es",
                "url": "http://127.0.0.1:8000/api/v2/language/7/"
            },
            "name": "Ciudad Fluxus"
        },
        {
            "language": {
                "name": "de",
                "url": "http://127.0.0.1:8000/api/v2/language/6/"
            },
            "name": "Fluxia City"
        },
        {
            "language": {
                "name": "fr",
                "url": "http://127.0.0.1:8000/api/v2/language/5/"
            },
            "name": "Flusselles"
        },
        {
            "language": {
                "name": "ko",
                "url": "http://127.0.0.1:8000/api/v2/language/3/"
            },
            "name": "\ud5a5\uc804\uc2dc\ud2f0"
        },
        {
            "language": {
                "name": "ja",
                "url": "http://127.0.0.1:8000/api/v2/language/1/"
            },
            "name": "\u30d2\u30e3\u30c3\u30b3\u30af\u30b7\u30c6\u30a3"
        }
    ],
    "region": {
        "name": "kalos",
        "url": "http://127.0.0.1:8000/api/v2/region/6/"
    }
}
