{"name":"cave-of-being","region":{"url":"http:\/\/127.0.0.1:8000\/api\/v2\/region\/5\/","name":"unova"},"game_indices":[{"generation":{"url":"http:\/\/127.0.0.1:8000\/api\/v2\/generation\/5\/","name":"generation-v"},"game_index":142}],"names":[{"name":"Cave of Being","language":{"url":"http:\/\/127.0.0.1:8000\/api\/v2\/language\/9\/","name":"en"}},{"name":"Caverne des Esprits","language":{"url":"http:\/\/127.0.0.1:8000\/api\/v2\/language\/5\/","name":"fr"}},{"name":"\u5fc3\u306e\u7a7a\u6d1e","language":{"url":"http:\/\/127.0.0.1:8000\/api\/v2\/language\/1\/","name":"ja"}}],"id":555,"areas":[]}
