{"name":"marvelous-bridge","region":{"url":"http:\/\/127.0.0.1:8000\/api\/v2\/region\/5\/","name":"unova"},"game_indices":[{"generation":{"url":"http:\/\/127.0.0.1:8000\/api\/v2\/generation\/5\/","name":"generation-v"},"game_index":68},{"generation":{"url":"http:\/\/127.0.0.1:8000\/api\/v2\/generation\/5\/","name":"generation-v"},"game_index":92}],"names":[{"name":"Marvelous Bridge","language":{"url":"http:\/\/127.0.0.1:8000\/api\/v2\/language\/9\/","name":"en"}},{"name":"Pont de l'Inconnu","language":{"url":"http:\/\/127.0.0.1:8000\/api\/v2\/language\/5\/","name":"fr"}},{"name":"\u30ef\u30f3\u30c0\u30fc\u30d6\u30ea\u30c3\u30b8","language":{"url":"http:\/\/127.0.0.1:8000\/api\/v2\/language\/1\/","name":"ja"}}],"id":410,"areas":[{"url":"http:\/\/127.0.0.1:8000\/api\/v2\/location-area\/622\/","name":"marvelous-bridge-area"}]}
